{"acceptance_gates": ["This artifact records proof obligations only; it is not a theorem-completion report.", "VC set-class entropy, VC-subgraph entropy, and Donsker weak convergence must stay separate.", "A GC certificate must not be promoted into Donsker evidence.", "Pre-Gaussianity, tightness, weak envelope tails, separability, and outer measurability must be explicit before exact theorem promotion.", "AXLE may assist extraction/checking, but local Lake and no-shortcut scans remain the acceptance authority."], "blocked_obligations": ["vdvw-2.6.4-vc-set-entropy-obligations", "vdvw-2.6.7-vc-subgraph-entropy-obligations", "vdvw-2.5.2-uniform-entropy-donsker-obligations", "vdvw-2.5.6-bracketing-donsker-obligations", "vdvw-2.6.8-vc-subgraph-donsker-obligations"], "markdown_root": "Math Textbook Foundation/Vaart 1996 Weak Convergence and Emperical Process(1)/Markdown", "next_actions": ["Start P12.M1 by designing primitive empirical sample and outer-convergence semantics.", "Add theorem-hole benchmarks for VC set entropy, VC-subgraph entropy, and Donsker weak-convergence constructors.", "Keep downstream estimator normality handoffs behind DonskerAsymptoticNormalityRoute until a real Donsker constructor is available."], "notes": "P11.M3 source-links VdV&W VC and Donsker targets to the missing Lean primitives and proof obligations needed before any exact theorem claim.", "obligation_count": 5, "obligations": [{"benchmark_task_ids": ["vc_deviation_certificate_gc_seed", "vc_subgraph_route_certificate_seed", "trivial_vc_subgraph_gc_non_vacuity_seed"], "current_lean_handoffs": ["StatInference.VCSubgraphProofObligations", "StatInference.VCSubgraphSpec", "StatInference.VCSubgraphGCRoute"], "formal_goal": "Construct a polynomial Lr(Q) covering-number bound for VC set classes from shattering and Sauer-style growth control.", "human_review_required": true, "missing_benchmark_task_ids": [], "obligation_id": "vdvw-2.6.4-vc-set-entropy-obligations", "promotion_gate": "Add theorem-hole signatures first; do not claim a VC entropy theorem until shattering and covering-number primitives compile.", "proof_obligations": ["reduce arbitrary probability measures to empirical-type measures", "translate set symmetric-difference distance into indicator Lr distance", "apply growth-function bound to construct a finite cover", "track universal constants without hiding theorem assumptions"], "required_primitives": ["set-class shattering predicate", "VC index or VC dimension for measurable set classes", "growth function Delta_n(C, x_1, ..., x_n)", "Sauer-Shelah growth bound", "Lr(Q) covering number for indicator set classes"], "semantic_risks": ["Current VCSubgraphSpec is metadata and does not prove shattering or Sauer bounds.", "Set-class VC entropy must stay separate from real-valued VC-subgraph entropy."], "source_label": "Theorem 2.6.4", "status": "blocked_pending_vc_primitives", "target_lean_names": ["StatInference.VCSetClassSpec", "StatInference.VCSetCoveringNumberBound", "StatInference.vdvw_2_6_4_vc_set_covering_bound"], "track": "vc_set_entropy", "validation_hooks": ["render and verify vc_deviation_certificate_gc_seed", "extract_decls on StatInference/EmpiricalProcess/VCSubgraph.lean", "run local no-sorry scan before any Lean promotion"]}, {"benchmark_task_ids": ["vc_subgraph_route_certificate_seed", "vc_deviation_certificate_gc_seed"], "current_lean_handoffs": ["StatInference.VCSubgraphProofObligations", "StatInference.VCDeviationCertificate", "StatInference.VCSubgraphGCRoute.toVCDeviationCertificate"], "formal_goal": "Lift the VC set-class covering bound to real-valued VC-subgraph classes with measurable envelope and envelope-scaled Lr(Q) radius.", "human_review_required": true, "missing_benchmark_task_ids": [], "obligation_id": "vdvw-2.6.7-vc-subgraph-entropy-obligations", "promotion_gate": "Promote only after set-class VC entropy and subgraph/envelope primitives are explicit.", "proof_obligations": ["prove subgraphs form a VC set class with the stated VC index", "derive the L1(Q) covering bound through product-measure geometry", "lift from r = 1 to general r >= 1 through envelope weighting", "preserve envelope measurability and nonzero-norm side conditions"], "required_primitives": ["subgraph set associated with a real-valued function", "measurable envelope and positive Lr(Q) envelope norm", "product measure with Lebesgue measure on the real line", "Fubini identity connecting Q|f-g| and subgraph symmetric difference", "envelope-weighted probability renormalization"], "semantic_risks": ["Dropping the measurable-envelope condition changes the theorem.", "A generic VCSubgraphGCRoute cannot be reused as evidence for the entropy theorem."], "source_label": "Theorem 2.6.7", "status": "blocked_pending_subgraph_envelope_primitives", "target_lean_names": ["StatInference.VCSubgraphEntropyObligations", "StatInference.VCSubgraphEnvelopeCoveringBound", "StatInference.vdvw_2_6_7_vc_subgraph_covering_bound"], "track": "vc_subgraph_entropy", "validation_hooks": ["render and verify vc_subgraph_route_certificate_seed", "check that VCDeviationCertificate remains proof-carrying", "AXLE check only after local Lake accepts candidate signatures"]}, {"benchmark_task_ids": ["donsker_statement_seed", "donsker_bridge_gc_projection_seed", "donsker_bridge_estimator_clt_seed"], "current_lean_handoffs": ["StatInference.DonskerSpec", "StatInference.DonskerBridgeCertificate", "StatInference.DonskerAsymptoticNormalityRoute"], "formal_goal": "Construct P-Donsker weak convergence from the uniform entropy condition, measurability of local difference classes, and a square-integrable envelope.", "human_review_required": true, "missing_benchmark_task_ids": [], "obligation_id": "vdvw-2.5.2-uniform-entropy-donsker-obligations", "promotion_gate": "Keep as proof-obligation card until empirical-process weak convergence and tightness APIs exist.", "proof_obligations": ["formalize symmetrization and Rademacher sub-Gaussian process bound", "connect maximal inequality to asymptotic equicontinuity", "prove finite-dimensional convergence or consume a CLT field", "assemble weak convergence and tightness into DonskerSpec"], "required_primitives": ["uniform entropy integral over finitely discrete Q", "L2(P) semimetric and local class F_delta", "outer measurability for F_delta and F_infty^2", "empirical process as random element in ell-infinity(F)", "tight Brownian bridge or pre-Gaussian target process"], "semantic_risks": ["Donsker is strictly stronger than GC and cannot be inferred from current GC certificates.", "Current DonskerSpec stores a weak-convergence statement but does not construct it from entropy."], "source_label": "Theorem 2.5.2", "status": "blocked_pending_donsker_semantics", "target_lean_names": ["StatInference.UniformEntropyDonskerObligations", "StatInference.vdvw_2_5_2_uniform_entropy_donsker"], "track": "uniform_entropy_donsker", "validation_hooks": ["render and verify donsker_statement_seed", "keep DonskerSpec as consumed weak-convergence evidence until primitives exist", "avoid converting GC-only certificates into Donsker evidence"]}, {"benchmark_task_ids": ["bracketing_certificate_gc_seed", "donsker_asymptotic_normality_handoff_seed", "trivial_donsker_asymptotic_normality_seed"], "current_lean_handoffs": ["StatInference.BracketingNumberSpec", "StatInference.DonskerBridgeCertificate", "StatInference.DonskerAsymptoticNormalityRoute.asymptoticNormal"], "formal_goal": "Construct P-Donsker weak convergence from finite L2 and weak-L2 bracketing/covering entropy integrals plus weak second moment.", "human_review_required": true, "missing_benchmark_task_ids": [], "obligation_id": "vdvw-2.5.6-bracketing-donsker-obligations", "promotion_gate": "Promote only after entropy-integral APIs and Donsker weak-convergence target are explicit.", "proof_obligations": ["construct finite partitions with summable entropy weights", "prove chaining bounds for empirical-process increments", "handle truncation through weak second-moment envelope control", "produce DonskerBridgeCertificate only after weak convergence is constructed"], "required_primitives": ["L2(P) bracketing/covering entropy integral", "L2,infty(P) weak bracketing entropy integral", "weak second-moment envelope condition", "partition-chain construction over the function class", "Donsker weak convergence target in function space"], "semantic_risks": ["Bracketing GC infrastructure is insufficient for bracketing Donsker.", "Entropy-integral finiteness and weak second moment are not encoded in BracketingNumberSpec."], "source_label": "Theorem 2.5.6", "status": "blocked_pending_entropy_integral_primitives", "target_lean_names": ["StatInference.BracketingDonskerObligations", "StatInference.vdvw_2_5_6_bracketing_entropy_donsker"], "track": "bracketing_donsker", "validation_hooks": ["render and verify bracketing_certificate_gc_seed", "render and verify donsker_asymptotic_normality_handoff_seed", "do not reuse bracketing GC certificate as Donsker proof"]}, {"benchmark_task_ids": ["vc_subgraph_route_certificate_seed", "donsker_bridge_estimator_clt_seed", "donsker_asymptotic_normality_handoff_seed"], "current_lean_handoffs": ["StatInference.VCSubgraphGCRoute", "StatInference.DonskerBridgeCertificate", "StatInference.DonskerAsymptoticNormalityRoute"], "formal_goal": "Construct P-Donsker for pointwise separable, P-pre-Gaussian VC-subgraph classes under a weak second-moment envelope tail.", "human_review_required": true, "missing_benchmark_task_ids": [], "obligation_id": "vdvw-2.6.8-vc-subgraph-donsker-obligations", "promotion_gate": "Keep as theorem card until pre-Gaussian, weak-tail, and Donsker semantics compile.", "proof_obligations": ["reuse VC-subgraph entropy only as an input obligation", "separate finite-second-moment shortcut through Theorem 2.5.2 from weak-tail refinement", "encode Alexander refinement as a theorem card until proof infrastructure exists", "connect finished Donsker proof to estimator normality only through Donsk